Run directory initialized at /Users/jean/Desktop/Python coding support/ann_optimization/runs/measurements2__5dc6b90f8a__IN_PROGRESS
Starting HPO optimization...
Trial 0 started.
Loading and splitting single file (one Dataset instance).
Applying One-Hot Encoding to categorical inputs: specials, gas_type, refill gas.
Total input features after OHE: 22
Performing Train/Test split: Test Ratio=0.20 (Random Seed=42).
Train samples: 310, Test samples: 78
Single-file mode: Test set created with shape (78, 23) and columns aligned to training features.
Features standardized successfully (Fitted and Transformed).
Run directory initialized at /Users/jean/Desktop/Python coding support/ann_optimization/runs/measurements2__5dc6b90f8a__IN_PROGRESS
Starting HPO optimization...
[best_cv_loss] inf
[best_intermediate_r2] None
[best_intermediate_nmae] None
[best_intermediate_accuracy] None
Starting new Optuna study for 100 trials.
Trial 0 started.
New best CV loss: 0.830477. Retraining candidate best model on full training data...
New best CV loss: 0.830477. Retraining candidate best model on full training data...
Full-data training for new best model completed (via train_final_model).
[best_model_saved] /Users/jean/Desktop/Python coding support/ann_optimization/runs/measurements2__5dc6b90f8a__IN_PROGRESS/best_model.pt
New best model found.
[scaler_params] /Users/jean/Desktop/Python coding support/ann_optimization/runs/measurements2__5dc6b90f8a__IN_PROGRESS/scaler_params.json
[best_predictions_csv] /Users/jean/Desktop/Python coding support/ann_optimization/runs/measurements2__5dc6b90f8a__IN_PROGRESS/best_predictions.csv
Run artifacts zipped for download: measurements2__5dc6b90f8a__IN_PROGRESS.zip
Trial 0 finished. Loss: 0.830477
Trial 1 started.
Full-data training for new best model completed (via train_final_model).
Applied fitted scaler to test data for live metrics.
[best_cv_loss] 0.8304766813913982
[best_intermediate_r2] 0.500128298997879
[best_intermediate_nmae] 0.10440713567676803
[best_intermediate_accuracy] 53.84615384615385
New best model found.
Run artifacts zipped for download: measurements2__5dc6b90f8a__IN_PROGRESS.zip
Trial 0 finished. Loss: 0.830477
Trial 0 finished. Loss: 0.830477
Trial 1 started.
New best CV loss: 0.783537. Retraining candidate best model on full training data...
New best CV loss: 0.783537. Retraining candidate best model on full training data...
Full-data training for new best model completed (via train_final_model).
[best_model_saved] /Users/jean/Desktop/Python coding support/ann_optimization/runs/measurements2__5dc6b90f8a__IN_PROGRESS/best_model.pt
New best model found.
[scaler_params] /Users/jean/Desktop/Python coding support/ann_optimization/runs/measurements2__5dc6b90f8a__IN_PROGRESS/scaler_params.json
[best_predictions_csv] /Users/jean/Desktop/Python coding support/ann_optimization/runs/measurements2__5dc6b90f8a__IN_PROGRESS/best_predictions.csv
Run artifacts zipped for download: measurements2__5dc6b90f8a__IN_PROGRESS.zip
Trial 1 finished. Loss: 0.783537
Trial 2 started.
Full-data training for new best model completed (via train_final_model).
Applied fitted scaler to test data for live metrics.
[best_cv_loss] 0.7835373113552729
[best_intermediate_r2] 0.4464975595474243
[best_intermediate_nmae] 0.11036472652933688
[best_intermediate_accuracy] 53.84615384615385
New best model found.
Run artifacts zipped for download: measurements2__5dc6b90f8a__IN_PROGRESS.zip
Trial 1 finished. Loss: 0.783537
Trial 1 finished. Loss: 0.783537
Trial 2 started.
New best CV loss: 0.664966. Retraining candidate best model on full training data...
New best CV loss: 0.664966. Retraining candidate best model on full training data...
Full-data training for new best model completed (via train_final_model).
[best_model_saved] /Users/jean/Desktop/Python coding support/ann_optimization/runs/measurements2__5dc6b90f8a__IN_PROGRESS/best_model.pt
New best model found.
[scaler_params] /Users/jean/Desktop/Python coding support/ann_optimization/runs/measurements2__5dc6b90f8a__IN_PROGRESS/scaler_params.json
[best_predictions_csv] /Users/jean/Desktop/Python coding support/ann_optimization/runs/measurements2__5dc6b90f8a__IN_PROGRESS/best_predictions.csv
Run artifacts zipped for download: measurements2__5dc6b90f8a__IN_PROGRESS.zip
Trial 2 finished. Loss: 0.664966
Trial 3 started.
Full-data training for new best model completed (via train_final_model).
Applied fitted scaler to test data for live metrics.
[best_cv_loss] 0.6649655684828758
[best_intermediate_r2] 0.4065293073654175
[best_intermediate_nmae] 0.10125179524156365
[best_intermediate_accuracy] 62.82051282051282
New best model found.
Run artifacts zipped for download: measurements2__5dc6b90f8a__IN_PROGRESS.zip
Trial 2 finished. Loss: 0.664966
Trial 2 finished. Loss: 0.664966
Trial 3 started.
Trial 3 finished. Loss: 0.779416
Trial 4 started.
Trial 3 finished. Loss: 0.779416
Trial 3 finished. Loss: 0.779416
Trial 4 started.
Trial 4 finished. Loss: 0.759103
Trial 5 started.
Trial 6 started.
Trial 7 started.
Trial 8 started.
Trial 9 started.
Trial 10 started.
Trial 11 started.
Trial 12 started.
Trial 13 started.
Trial 14 started.
Trial 15 started.
Trial 16 started.
Trial 17 started.
Trial 18 started.
Trial 19 started.
Trial 20 started.
Trial 21 started.
Trial 22 started.
Trial 23 started.
Trial 24 started.
Trial 25 started.
Trial 4 finished. Loss: 0.759103
Trial 4 finished. Loss: 0.759103
Trial 5 started.
Trial 5 pruned.
Trial 6 started.
Trial 6 pruned.
Trial 7 started.
Trial 7 pruned.
Trial 8 started.
Trial 8 pruned.
Trial 9 started.
Trial 9 pruned.
Trial 10 started.
Trial 10 pruned.
Trial 11 started.
Trial 11 pruned.
Trial 12 started.
Trial 12 pruned.
Trial 13 started.
Trial 13 pruned.
Trial 14 started.
Trial 14 pruned.
Trial 15 started.
Trial 15 pruned.
Trial 16 started.
Trial 16 pruned.
Trial 17 started.
Trial 17 pruned.
Trial 18 started.
Trial 18 pruned.
Trial 19 started.
Trial 19 pruned.
Trial 20 started.
Trial 20 pruned.
Trial 21 started.
Trial 21 pruned.
Trial 22 started.
Trial 22 pruned.
Trial 23 started.
Trial 23 pruned.
Trial 24 started.
Trial 24 pruned.
Trial 25 started.
Trial 26 started.
Trial 27 started.
Trial 28 started.
Trial 29 started.
Trial 30 started.
Trial 31 started.
Trial 32 started.
Trial 33 started.
Trial 34 started.
Trial 35 started.
Trial 36 started.
Trial 37 started.
Trial 38 started.
Trial 39 started.
Trial 40 started.
Trial 41 started.
Trial 42 started.
Trial 43 started.
Trial 44 started.
Trial 45 started.
Trial 46 started.
Trial 47 started.
Trial 48 started.
Trial 49 started.
Trial 25 pruned.
Trial 26 started.
Trial 26 pruned.
Trial 27 started.
Trial 27 pruned.
Trial 28 started.
Trial 28 pruned.
Trial 29 started.
Trial 29 pruned.
Trial 30 started.
Trial 30 pruned.
Trial 31 started.
Trial 31 pruned.
Trial 32 started.
Trial 32 pruned.
Trial 33 started.
Trial 33 pruned.
Trial 34 started.
Trial 34 pruned.
Trial 35 started.
Trial 35 pruned.
Trial 36 started.
Trial 36 pruned.
Trial 37 started.
Trial 37 pruned.
Trial 38 started.
Trial 38 pruned.
Trial 39 started.
Trial 39 pruned.
Trial 40 started.
Trial 40 pruned.
Trial 41 started.
Trial 41 pruned.
Trial 42 started.
Trial 42 pruned.
Trial 43 started.
Trial 43 pruned.
Trial 44 started.
Trial 44 pruned.
Trial 45 started.
Trial 45 pruned.
Trial 46 started.
Trial 46 pruned.
Trial 47 started.
Trial 47 pruned.
Trial 48 started.
Trial 48 pruned.
Trial 49 started.
Trial 50 started.
Trial 51 started.
Trial 52 started.
Trial 53 started.
Trial 54 started.
Trial 55 started.
Trial 49 pruned.
Trial 50 started.
Trial 50 pruned.
Trial 51 started.
Trial 51 pruned.
Trial 52 started.
Trial 52 pruned.
Trial 53 started.
Trial 53 pruned.
Trial 54 started.
Trial 54 pruned.
Trial 55 started.
Trial 56 started.
Trial 57 started.
Trial 58 started.
Trial 55 pruned.
Trial 56 started.
Trial 56 pruned.
Trial 57 started.
Trial 57 pruned.
Trial 58 started.
Trial 59 started.
Trial 60 started.
Trial 61 started.
Trial 58 pruned.
Trial 59 started.
Trial 59 pruned.
Trial 60 started.
Trial 60 pruned.
Trial 61 started.
Trial 62 started.
Trial 63 started.
Trial 61 pruned.
Trial 62 started.
Trial 62 pruned.
Trial 63 started.
Trial 64 started.
Trial 65 started.
Trial 66 started.
Trial 67 started.
Trial 68 started.
Trial 69 started.
Trial 70 started.
Trial 71 started.
Trial 63 pruned.
Trial 64 started.
Trial 64 pruned.
Trial 65 started.
Trial 65 pruned.
Trial 66 started.
Trial 66 pruned.
Trial 67 started.
Trial 67 pruned.
Trial 68 started.
Trial 68 pruned.
Trial 69 started.
Trial 69 pruned.
Trial 70 started.
Trial 70 pruned.
Trial 71 started.
Trial 72 started.
Trial 71 pruned.
Trial 72 started.
Trial 73 started.
Trial 74 started.
Trial 75 started.
Trial 76 started.
Trial 77 started.
Trial 78 started.
Trial 79 started.
Trial 80 started.
Trial 81 started.
Trial 72 pruned.
Trial 73 started.
Trial 73 pruned.
Trial 74 started.
Trial 74 pruned.
Trial 75 started.
Trial 75 pruned.
Trial 76 started.
Trial 76 pruned.
Trial 77 started.
Trial 77 pruned.
Trial 78 started.
Trial 78 pruned.
Trial 79 started.
Trial 79 pruned.
Trial 80 started.
Trial 80 pruned.
Trial 81 started.
Trial 82 started.
Trial 83 started.
Trial 84 started.
Trial 85 started.
Trial 86 started.
Trial 87 started.
Trial 88 started.
Trial 89 started.
Trial 81 pruned.
Trial 82 started.
Trial 82 pruned.
Trial 83 started.
Trial 83 pruned.
Trial 84 started.
Trial 84 pruned.
Trial 85 started.
Trial 85 pruned.
Trial 86 started.
Trial 86 pruned.
Trial 87 started.
Trial 87 pruned.
Trial 88 started.
Trial 88 pruned.
Trial 89 started.
Trial 89 finished. Loss: 0.886702
Trial 90 started.
Trial 91 started.
Trial 92 started.
Trial 93 started.
Trial 89 finished. Loss: 0.886702
Trial 89 finished. Loss: 0.886702
Trial 90 started.
Trial 90 pruned.
Trial 91 started.
Trial 91 pruned.
Trial 92 started.
Trial 92 pruned.
Trial 93 started.
Trial 94 started.
Trial 95 started.
Trial 96 started.
Trial 97 started.
Trial 98 started.
Trial 99 started.
Trial 93 pruned.
Trial 94 started.
Trial 94 pruned.
Trial 95 started.
Trial 95 pruned.
Trial 96 started.
Trial 96 pruned.
Trial 97 started.
Trial 97 pruned.
Trial 98 started.
Trial 98 pruned.
Trial 99 started.
Optimization complete. Optuna study object saved for visualization.
Using best intermediate model for final outputs (renamed to final).

Dataset: measurements2
Config Hash: 5dc6b90f8a
Status: DONE
Started: 2025-12-04T13:05:44.055380
Finished: 2025-12-04T13:07:13.398137
Best CV Loss: 0.6649655684828758
Test Metrics (best model on unseen data):
  NMAE: 0.10125179524156365
  R2: 0.4065293073654175
  Accuracy: 62.82051282051282Final metrics on unseen data: r2score: 0.4065293073654175, NMA: 0.10125179524156365, accuracy: 62.82051282051282
Trial 99 pruned.
Optimization finished.
Optimization complete. Optuna study object saved for visualization.
Using best intermediate model for final outputs (renamed to final).
Final test metrics — NMAE: 0.10125179524156365, R2: 0.4065293073654175, Accuracy: 62.82051282051282
Run artifacts zipped (DONE): measurements2__5dc6b90f8a__DONE.zip
--- Training thread finished ---
Features selected via '*': distance, speed, temp_outside, AC, rain, sun, specials_AC, specials_AC Sun, specials_AC rain, specials_AC snow, specials_AC sun, specials_ac, specials_ac rain, specials_half rain half sun, specials_rain, specials_snow, specials_sun, specials_sun ac, gas_type_E10, gas_type_SP98, refill gas_E10, refill gas_SP98.
No categorical input features found. Skipping One-Hot Encoding.
Features standardized successfully (Transformed using provided scaler).
